{
  "week": 18,
  "iso_week": "2026-W18",
  "date_range": { "start": "2026-04-27", "end": "2026-05-03" },
  "theme": {
    "name": { "en": "Sunflower Sowing Week", "da": "Solsikke Uge" },
    "tagline": { "en": "Plant a seed taller than YOU!", "da": "Plant et froe der bliver hoejere end DIG!" },
    "hero_task": "Sow sunflower seeds in Bed A"
  },
  "tasks": [
    {
      "id": "W18-01",
      "action": "Sow sunflower seeds in Bed A",
      "priority": "must_do",
      "who": "child",
      "minutes": 10,
      "frequency": "once",
      "bed": "bed-a",
      "crop_id": "sunflower",
      "prompt": { "en": "Push the big seed into the soil with your thumb -- this will grow taller than you!", "da": "Tryk det store froe ned i jorden med tommelfingeren -- den bliver hoejere end dig!" }
    },
    {
      "id": "W18-02",
      "action": "Water all beds",
      "priority": "must_do",
      "who": "child",
      "minutes": 10,
      "frequency": "daily",
      "prompt": { "en": "Give each bed a good drink -- feel the soil first to check if it's dry.", "da": "Giv hvert bed en god slurk -- maaerk jorden foerst for at tjekke om den er toer." }
    },
    {
      "id": "W18-03",
      "action": "Sow kale seeds in Bed C",
      "priority": "must_do",
      "who": "together",
      "minutes": 10,
      "frequency": "once",
      "bed": "bed-c",
      "crop_id": "kale-nero-di-toscana",
      "prompt": { "en": "These tiny seeds will grow into dinosaur kale -- the leaves look like dinosaur skin!", "da": "De her smaa froe bliver til dinosaur-groenkal -- bladene ligner dinosaurhud!" }
    },
    {
      "id": "W18-04",
      "action": "Thin radish seedlings in Bed A if too crowded",
      "priority": "nice_to_do",
      "who": "together",
      "minutes": 5,
      "frequency": "once",
      "bed": "bed-a",
      "crop_id": "radish",
      "prompt": { "en": "Some radishes are too close together -- pull out the smallest ones so the big ones have room.", "da": "Nogle radiser staar for taet -- traek de mindste op saa de store faar plads." }
    },
    {
      "id": "W18-05",
      "action": "Check pea shoots for first tendrils in Bed C",
      "priority": "nice_to_do",
      "who": "child",
      "minutes": 5,
      "frequency": "weekly",
      "bed": "bed-c",
      "crop_id": "pea-kelvedon-wonder",
      "prompt": { "en": "Can you find the curly bits? Those are tendrils -- the pea is reaching for the trellis!", "da": "Kan du finde de krulle-ting? Det er snotraade -- aerten raekker efter espalieren!" }
    }
  ],
  "growth_events": [
    {
      "crop_id": "pea-kelvedon-wonder",
      "event": "Pea seedlings showing first tendrils reaching for trellis",
      "prompt": { "en": "Can you find the curly bits grabbing the wire? The pea is climbing!", "da": "Kan du finde de krulle-ting, der griber traaden? Aerten klatrer!" }
    },
    {
      "crop_id": "radish",
      "event": "Radish seedlings developing first true leaves",
      "prompt": { "en": "See the rough new leaves? Those are the real leaves -- the round ones were just the starter pack!", "da": "Ser du de ru nye blade? Det er de rigtige blade -- de runde var bare startpakken!" }
    }
  ],
  "sowing_tasks": [
    {
      "crop_id": "radish",
      "bed": "bed-c",
      "slot": "S1",
      "action": "Sow second succession radish in Bed C"
    }
  ]
}
